Title,Published_date,Views,Likes,Categories,Comments
Some thoughts on beauty as currency (and better long-term investments),2025-01-16T02:15:57Z,64826,5707,26,145
Why It Feels Like You’ll Never Catch Up,2025-01-14T00:02:05Z,13907,843,26,15
Supporting You With Your 2025 Money Resolutions,2025-01-09T21:11:00Z,8491,349,26,6
Why It Feels Like You’ll Never Catch Up,2024-12-31T17:00:06Z,492349,2946,26,192
Lean In & The Curse Of “Having It All”,2024-12-30T17:00:38Z,39558,1314,26,176
Gavin Newsom's new view on men in women's sports,2025-03-15T22:00:31Z,27751,3343,25,99
"Newsom Tries Podcasting, NASA Tries a Moon Landing, and Florida Tries Murder for Hire",2025-03-15T19:00:44Z,61905,2473,25,197
OF COURSE a ghost hunter murder for hire story takes place in Florida,2025-03-15T17:00:29Z,31962,3898,25,134
This will be a VERY disappointing moment for the world,2025-03-15T15:01:07Z,62556,4942,25,251
Top 4 Historically INACCURATE Films,2025-03-15T14:00:34Z,81226,3241,25,879
The DOEs death by 2000 cuts,2025-03-15T03:00:53Z,53583,5923,25,262
Democrats are beginning to CURSE in interviews!?,2025-03-15T01:00:24Z,46489,4064,25,291
The Babylon Bee CEO Seth Dillon On Doing Comedy In This Absurd Era,2025-03-14T23:00:25Z,20617,969,25,186
Jasmine Crockett is the new AOC,2025-03-14T22:00:20Z,37316,3433,25,339
Speaker Mike Johnson On Reducing The Size And Scope Of The Federal Government,2025-03-14T21:00:12Z,17281,1006,25,178
Mike Johnson's AMAZING analogy about the federal government,2025-03-14T19:00:05Z,71899,6855,25,137
"Democrats CAVE, Trump Chalks Up Another Win!",2025-03-14T17:00:06Z,260060,8119,25,1738
Maybe Dana Bash Shouldn't Say This Anymore,2025-03-14T15:00:05Z,152670,7668,25,233
Trump RAVES about Conor McGregor,2025-03-14T03:00:19Z,59640,4113,25,108
Trump's having fun with the President of Ireland,2025-03-14T01:00:46Z,106241,7725,25,254
Marco Rubio Was Made For This,2025-03-13T23:00:03Z,45959,2764,25,1256
Not liking Meghan Markle's Netflix show makes you racist?,2025-03-13T22:00:24Z,122892,10401,25,670
MSNBC And CNN Just CAN'T HANDLE DOGE,2025-03-13T21:00:13Z,92139,3147,25,421
John Fetterman begs for Democrats to be NORMAL for once,2025-03-13T19:29:16Z,327600,24592,25,923
Democrats To SHUT DOWN The Government?,2025-03-13T17:00:06Z,199868,6297,25,1428
Trump's BIG victory of the day!,2025-03-13T15:01:06Z,79437,10157,25,246
Trump is just innately ICONIC,2025-03-13T03:00:27Z,93872,8114,25,197
College degrees are a SCAM,2025-03-13T01:00:39Z,112395,10514,25,446
"Ukraine Agrees To Ceasefire, What's Next?",2025-03-12T23:00:18Z,81036,2533,25,715
Elon Musk brings Tesla to the White House,2025-03-12T22:00:24Z,49796,4039,25,298
Democrats FREAK OUT During House Committee Meeting Over Pronouns,2025-03-12T21:00:06Z,108443,3675,25,715
What is the goal here?,2025-03-12T19:19:10Z,72550,4907,25,623
Trump SLASHES AND BURNS Through Department of Education!,2025-03-12T17:00:06Z,218843,7444,25,1609
How will the world perceive our aim at Canada?,2025-03-12T15:00:54Z,166791,7740,25,781
America NEEDS to be more competitive,2025-03-12T03:00:24Z,60915,4163,25,129
Not EVERYBODY knows the ins and outs of your industry,2025-03-12T01:00:00Z,67024,4773,25,158
How Can We Solve The National Debt Problem?,2025-03-11T23:00:16Z,62547,2319,25,902
Millionaire vs. Billionaire: Bill Burr comes after Elon Musk AGAIN,2025-03-11T22:00:43Z,97739,4839,25,591
Democrats And Whoopi Goldberg Are LOSING IT,2025-03-11T21:00:56Z,128649,4350,25,535
Is Van Jones the last sane Democrat?,2025-03-11T19:00:03Z,198511,14046,25,451
Stock Market PLUNGES…So What’s Next?!,2025-03-11T17:00:06Z,277818,7516,25,3851
Democrats need to admit they have a problem,2025-03-11T15:00:00Z,67370,6505,25,289
Rep. Chip Roy on why a spending freeze is a HUGE win,2025-03-11T03:00:42Z,49677,4256,25,59
Mark Carney is the NEW Prime Minister of Canada,2025-03-11T01:00:21Z,218058,9528,25,1582
I Can't Believe I Agree With This Woke Chick,2025-03-10T23:00:42Z,85582,2240,25,447
'Love Is Blind' star Ben was an IDIOT for this,2025-03-10T22:00:30Z,84701,5430,25,254
What Will These Tariffs Do To The United States Economy?,2025-03-10T21:00:13Z,152880,4234,25,2123
Trump's smart response about the economy,2025-03-10T19:17:22Z,157341,9664,25,630
Stephen A. Smith ATTACKS Me!,2025-03-10T17:00:06Z,251546,7549,25,2318
The media LOVED President Trump until he won,2025-03-10T00:00:43Z,81049,6645,25,90
The beginning of the end for Jimmy Fallon,2025-03-09T20:00:15Z,102086,7304,25,122
Mommy vloggers force their kids to FAKE IT @TheCommentsSection,2025-03-09T01:00:44Z,59412,4303,25,162
Gen Z is MORE pro-marriage than most people think! @TheCommentsSection,2025-03-08T22:00:05Z,52963,2848,25,271
"Trump Wins, Hollywood Whines, and Casey Anthony Tries TikTok",2025-03-08T20:00:11Z,118566,4210,25,511
Democrats post a CRINGE viral video,2025-03-08T16:00:29Z,113423,11161,25,1244
Tornado aftermath amid severe weather outbreak,2025-03-16T05:11:29Z,7245,250,25,28
Remarkable drone mission to find a lost puppy,2025-03-16T05:00:02Z,2731,114,25,14
Trump signs funding bill,2025-03-16T02:30:02Z,10773,94,25,69
Russian troops advance in Kursk,2025-03-16T02:00:41Z,43560,485,25,341
Major tornado outbreak across the South,2025-03-16T01:40:40Z,147373,1486,25,580
"ABC World News Tonight with David Muir Full Broadcast - March 15, 2025",2025-03-16T01:00:31Z,739690,8165,25,1398
Trump orders attacks against Houthis in Yemen,2025-03-15T21:52:30Z,264470,2370,25,2758
Mayor of Oklahoma town on devastation left by wildfires,2025-03-15T20:59:34Z,11506,166,25,113
LIVE WEATHER MAP: Tracking severe weather outbreak,2025-03-15T20:34:59Z,66766,287,25,11
"Good Morning America Full Broadcast — Saturday, March 15, 2025",2025-03-15T17:35:12Z,58054,451,25,76
Severe storms hit the Midwest and the South,2025-03-15T17:14:32Z,8323,269,25,10
Strong Dollar drives American travelers abroad,2025-03-15T17:00:33Z,2456,33,25,21
Measles cases grow as RFK Jr. makes controversial claims about treatment,2025-03-15T15:09:41Z,6237,105,25,116
SpaceX launches mission to get NASA astronauts back on earth,2025-03-15T14:10:04Z,36365,237,25,300
Over 60 Million Americans on alert for severe weather,2025-03-15T14:07:36Z,202330,1845,25,805
Doctors reflect on frontlines of COVID-19 pandemic 5 years later,2025-03-15T12:55:09Z,2147,39,25,44
Chilling 911 call in the Idaho college murders,2025-03-15T12:06:28Z,83638,1158,25,505
"Nightline Full Broadcast — Friday, March 14, 2025",2025-03-15T10:33:16Z,5235,214,25,46
"LIVE: ABC News Live - Friday, March 14",2025-03-15T03:58:13Z,95803,784,25,0
Space expert on the SpaceX launch of 4 astronauts to the ISS,2025-03-15T03:45:02Z,10453,48,25,21
"ABC News Live Prime: Friday, March 14, 2025",2025-03-15T03:06:48Z,20610,171,25,15
SpaceX mission launches to ISS to bring astronauts back to Earth,2025-03-15T03:06:16Z,21562,831,25,101
Underground hospital treats wounded Ukrainian soldiers: Exclusive,2025-03-15T02:45:03Z,2229,49,25,37
"ABC World News Tonight with David Muir Full Broadcast - March 14, 2025",2025-03-15T02:30:25Z,699127,7479,25,1261
Trump slams prosecutions in Justice Department visit,2025-03-15T02:15:02Z,28629,234,25,264
American Airlines flight catches fire at Denver airport,2025-03-15T02:00:19Z,16983,154,25,100
"Cross-country storm brings tornado threats, fire conditions to multiple states",2025-03-15T01:45:03Z,100624,1031,25,391
LIVE: NASA launches SpaceX Crew-10 mission to bring home astronauts on ISS,2025-03-14T23:41:25Z,105263,1001,25,101
"California Democratic representative on spending bill, economy",2025-03-14T23:30:00Z,1674,27,25,15
Attorneys for Mahmoud Khalil release video of arrest,2025-03-14T23:15:04Z,25629,339,25,701
ABC News obtains 911 call in Idaho college killings,2025-03-14T22:33:15Z,34519,337,25,229
Texas dust storm topples trucks,2025-03-14T22:04:16Z,18905,612,25,44
Stocks rebound as tariffs weigh on Wall Street,2025-03-14T21:30:09Z,3340,55,25,30
Sean 'Diddy' Combs pleads not guilty to superseding indictment,2025-03-14T21:15:02Z,8942,91,25,46
LIVE: Pres. Trump delivers remarks at Department of Justice,2025-03-14T20:53:44Z,66535,792,25,368
"Trump, at Justice Department, decries 'weaponization' after prosecutions dismissed",2025-03-14T20:44:40Z,12349,166,25,174
Canada's new PM Mark Carney delivers 1st remarks,2025-03-14T19:43:20Z,11514,162,25,195
'We have a long way to go': educator on pandemic impact on students,2025-03-14T19:07:17Z,769,12,25,4
"LIVE: Senate confirmation hearing for Dr. Oz, Trump's nominee to lead Medicaid and Medicare",2025-03-14T17:38:20Z,28227,252,25,65
"Wendy Williams talks guardianship, gives health update on 'The View'",2025-03-14T16:54:47Z,20132,277,25,106
"Good Morning America Full Broadcast — Friday, March 14, 2025",2025-03-14T16:25:09Z,98791,572,25,87
Dr. Mehmet Oz delivers opening remarks at confirmation hearing,2025-03-14T15:24:57Z,6105,77,25,55
House Dems break with Schumer over vote to avoid government shutdown,2025-03-14T15:22:42Z,118879,2226,25,1148
Man who last saw missing student Sudiksha Konanki thought she took 'her things and left',2025-03-14T15:17:16Z,53061,299,25,281
Hamas says it will release American hostage Edan Alexander,2025-03-14T13:46:23Z,5159,54,25,35
"North Carolina town hall erupts in boos as congressman escorted from building, angry constituents",2025-03-14T13:21:49Z,120241,2019,25,1902
Millions on alert as massive storm moves east,2025-03-14T12:30:49Z,33337,222,25,44
Stocks plunge as Trump ramps up tariff threats,2025-03-14T12:17:23Z,112849,1046,25,1377
Megachurch founder indicted in child sex abuse case,2025-03-14T11:00:32Z,8373,122,25,176
"Nightline Full Broadcast -- Thursday, March 13",2025-03-14T10:01:09Z,763,16,25,2
Fastest Remote Control Car in the WORLD,2025-03-13T15:04:06Z,8663234,522691,28,969
I tested the FIRST EVER limited Edition iPhone!,2025-03-08T14:00:06Z,5288261,151123,28,4608
7 WEIRDEST AirPod Cases!,2025-03-06T11:03:26Z,935309,83553,28,268
The Best Phone Camera in the World,2025-03-03T09:25:00Z,2716165,189091,28,1946
The 2 Best Phone Cameras in the World.,2025-03-03T06:30:09Z,3660925,95797,28,6951
Level 1 vs Level 100 Lighter,2025-02-25T20:20:52Z,2704298,224134,28,873
I bought the Ultimate Survival Tech,2025-02-22T13:24:28Z,5191350,186101,28,5756
This Gadget BRICKS Your Phone!,2025-02-21T14:57:07Z,5009384,413570,28,3541
Oppo Find N5 Review - Samsung just got Demolished!?,2025-02-20T12:00:17Z,5048062,116383,28,6895
This Phone Gimbal Has an Insane Trick!,2025-02-18T13:02:23Z,379104,33153,28,294
13 Tragic Tech Fails that need to DIE,2025-02-08T14:05:48Z,3300798,120166,28,4685
5 Phone Cases With SECRET Abilities!,2025-02-05T15:41:53Z,3704660,238754,28,655
Samsung S25 Ultra Review - Things just got Messy.,2025-01-29T21:06:54Z,4109310,124335,28,8971
Is your phone DIRTIER than a Toilet?,2025-01-28T17:15:42Z,1322328,104889,28,802
Samsung S25 Ultra vs iPhone 16 Pro Max Camera Battle,2025-01-26T16:07:09Z,3769090,115642,28,7692
I tested the $2000 RTX 5090 Graphics Card,2025-01-23T14:03:22Z,4682518,133258,28,6921
Samsung S25 Ultra Hands On - The New Era,2025-01-22T18:00:32Z,5213723,173404,28,11097
6 Most CURSED Gadgets!,2025-01-20T14:37:10Z,3038485,194523,28,613
The Most Idiot-Proof Drone Ever,2025-01-14T13:00:45Z,1632751,92458,28,674
These iPhone Tricks Will Change Your Life,2025-01-13T19:21:31Z,2243522,140799,28,965
Which $0 Phone Case Wins?,2025-01-12T16:21:06Z,1625255,112353,28,789
I built the Dream Studio,2025-01-11T13:48:38Z,3077729,141699,28,9359
Asking My AI Glasses Harder and Harder Questions #raybanmeta,2025-01-10T18:53:57Z,1898067,136133,28,598
I built the Dream Smart Garden,2025-01-05T12:00:00Z,3071422,106647,28,5181
The DJI Air 3S Has A Secret,2024-12-31T00:37:54Z,1599349,99201,28,640
I built the Dream Smart Home Gym,2024-12-28T14:06:43Z,2987809,101758,28,4554
I built the Dream Smart Kitchen,2024-12-21T13:35:57Z,4554031,136945,28,7434
The INSANE Tech behind MrBeast’s Biggest Video Ever,2024-12-19T17:00:00Z,4725490,167661,28,6172
Most Futuristic Christmas Tree!,2024-12-18T17:05:02Z,1734234,118890,28,763
I tested the 14 most OVERKILL Smartphone Gadgets,2024-12-16T12:26:27Z,3337595,88873,28,2862
The Most CUSTOMISABLE Phone Case!,2024-12-10T19:11:17Z,4152831,296297,28,1366
I built the Dream Smart Bedroom!,2024-12-07T12:13:18Z,3771699,123890,28,6259
I built the Dream Office Setup!,2024-11-30T15:57:36Z,3953362,143052,28,5866
Smartest Robot Vacuum EVER,2024-11-29T19:12:54Z,699322,46321,28,424
The BEST Smartphones of 2024!,2024-11-29T11:13:15Z,4876428,169488,28,11073
Can you hear this!?,2024-11-28T17:58:05Z,6767944,471024,28,15325
I built the DREAM Smart Living Room!,2024-11-24T12:02:59Z,4917469,164202,28,8015
They put AI...into a Lamp...,2024-11-22T21:23:14Z,918679,53420,28,666
I bought every iPad EVER!,2024-11-22T10:54:37Z,4546361,139326,28,6414
I built the DREAM Gaming Setup!,2024-11-16T12:17:23Z,4455870,194156,28,8730
The Smallest Microscope in the World!,2024-11-15T18:39:16Z,13598121,746144,28,2277
I tested the Craziest Xiaomi Gadgets!,2024-11-13T12:04:54Z,10671514,274275,28,10407
I bought my Dream House!,2024-11-09T12:23:29Z,4045683,209215,28,11547
My last video here,2024-11-02T12:14:44Z,4906157,357098,28,25378
I bought the most BEAUTIFUL Phones on the Internet!,2024-10-30T12:47:44Z,4864553,155910,28,6793
The TRIPLE FOLDING phone has a Problem.,2024-10-26T14:06:50Z,4565584,124814,28,6517
13 Most EMBARRASSING Tech Fails of all time.,2024-10-19T12:06:19Z,4686173,142001,28,5128
Controlling a Bird With My Phone,2024-10-16T12:33:10Z,4688163,276782,28,1345
Why Google Search is Falling Apart.,2024-10-12T11:47:29Z,4102827,198753,28,16251
5 Most BIZARRE Pokemon Gadgets,2024-10-08T12:28:42Z,2099324,126870,28,0
Can You Be Deported for What You Say?,2025-03-16T08:38:45Z,6256,355,25,278
Family watches tornado pass by their home,2025-03-16T02:11:40Z,21933,1247,25,168
Comedian nails question about illegal seizures at the border,2025-03-16T00:15:26Z,17494,1503,25,69
Chicago river dyed green in St. Patrick's Day tradition,2025-03-16T00:11:34Z,13253,439,22,64
ISIS #2 leader killed in US airstrike,2025-03-15T16:47:57Z,25196,788,22,143
Adam Kinzinger on Newsom having Bannon on podcast: 'This is nuts',2025-03-15T14:50:01Z,98355,1007,25,1181
Cari Champion: My 95-year-old grandma regrets Trump vote,2025-03-15T14:20:00Z,56737,726,25,1287
Passenger captures video as tornado passes,2025-03-15T14:08:04Z,45094,1656,22,98
Toure: I am thinking about leaving the Democratic Party,2025-03-15T12:00:38Z,152150,1673,25,1821
New Video of ICE's arrest of campus protest activist Mahmoud Khalil,2025-03-15T11:00:23Z,103292,1349,25,2113
Videos show vehicle pileup caused by dust storms in Texas,2025-03-15T04:29:22Z,26406,954,25,100
DHS official unable to answer 'basic questions' on Mahmoud Khalil,2025-03-15T02:14:04Z,22068,854,25,165
Anderson Cooper: Trump took a victory lap at Department of Justice,2025-03-15T01:58:43Z,144272,1939,25,1982
'Survivor' contestant on his stutter,2025-03-14T23:08:35Z,6627,309,22,20
Video of Mahmoud Khalil’s arrest released,2025-03-14T22:35:34Z,44197,1532,22,740
How a notorious military contractor got back in Trump’s orbit,2025-03-14T21:51:28Z,10038,262,25,46
Trump’s history of product endorsements,2025-03-14T21:21:53Z,12699,434,22,141
Bonkers for bagels in Beijing,2025-03-14T21:17:06Z,4225,129,22,15
Trump ‘not gonna bend’ on tariffs as markets tank,2025-03-14T21:10:56Z,17144,574,25,99
'It's very scary': People who voted for Trump in 2024 react to his early moves,2025-03-14T20:30:04Z,346576,4357,25,3969
Fetterman mocks Democrats calling for government shutdown,2025-03-14T19:48:44Z,11132,310,22,270
Tapper explains 'jaw-dropping' 2001 corporate scandal,2025-03-14T19:37:28Z,15788,520,25,43
Hear what Canada’s new prime minister said about Trump after being sworn in,2025-03-14T19:19:46Z,1820853,17181,25,8686
Jake Tapper Examines the Mark Sanford “Appalachian Trail” Scandal | United States of Scandal S1,2025-03-14T19:06:55Z,10790,130,25,55
Expert explains why plane passengers had to walk on plane's wing,2025-03-14T18:13:59Z,244551,2600,25,1284
"The reality in Doral, Florida, after Trump revoked deportation protections for Venezuelans",2025-03-14T17:42:01Z,9246,293,25,71
Hear ex-Treasury secretary’s prediction if Trump doesn’t change course,2025-03-14T17:26:02Z,511506,4685,25,2419
See people react to 'blood moon',2025-03-14T16:57:48Z,9769,357,25,51
Close friend of Liam Payne speaks out,2025-03-14T16:22:19Z,6584,137,25,23
Trump admin. Requests ‘military options’ for access to Panama Canal,2025-03-14T16:13:36Z,376189,3046,25,2840
First responders pull man from flooded car,2025-03-14T15:25:58Z,5946,291,22,2
"Adam Kinzinger: If your representative ducks town halls, demand one",2025-03-14T15:00:08Z,179625,2890,25,1879
Opinion: 3 ways DOGE challengers could win court cases,2025-03-14T14:58:15Z,13966,582,22,68
‘Toronto Mike’ says Trump’s words have realigned Canadian politics,2025-03-14T14:12:29Z,323313,2550,25,2376
How to avoid science and health misinfo,2025-03-14T13:43:23Z,11430,1076,25,31
Man escapes alleged 20 years of captivity using hand sanitizer and printer paper,2025-03-14T13:03:00Z,462414,4466,25,1914
How Dylan Mulvaney overcame 'Beergate',2025-03-14T12:48:47Z,6877,203,22,156
AOC breaks with Schumer on GOP government funding bill,2025-03-14T12:17:13Z,421428,10346,25,4961
Crowd boos JD Vance at Kennedy Center concert,2025-03-14T11:40:17Z,135297,5976,22,1288
American Airlines plane engine catches fire at Denver airport,2025-03-14T11:36:01Z,424398,4092,25,2487
Audience applauds man identifying as a veteran after confronting lawmaker at town hall,2025-03-14T10:00:18Z,519022,8733,25,4073
American Airlines plan engine catches fire,2025-03-14T09:42:20Z,93507,2947,25,697
Are You Falling for Health Misinformation?,2025-03-14T09:37:50Z,2945,43,25,23
How Trump's EPA cuts hit blue and red states alike,2025-03-14T03:55:49Z,28441,1565,25,144
Man escorted out of GOP town hall,2025-03-14T03:16:25Z,77931,3544,25,538
Tesla employee: Tariffs bad for business,2025-03-14T03:15:47Z,254223,9995,25,787
Probe captures rare images of moon orbiting Mars,2025-03-14T01:10:44Z,8624,280,25,12
AOC on break with Schumer over GOP spending bill,2025-03-14T00:13:13Z,62025,2119,22,571
Trump threatens more tariffs against allies,2025-03-13T23:30:10Z,42775,1189,25,443
Republicans respond to cutting medical research,2025-03-13T22:34:37Z,29283,1381,25,240
Thousands of You are Buying Dangerous Power Supplies,2025-03-15T17:09:36Z,771444,35539,28,1858
"Come Join Me In Linus Town USA - WAN Show March 14, 2025",2025-03-15T05:22:22Z,252059,5385,28,867
"I lose my 16,000,000 subs. Now what?",2025-03-14T17:29:50Z,282629,12392,28,166
Is my 3D printing setup wrong?,2025-03-13T17:00:34Z,1059943,37882,28,2522
You’re Probably Wasting Money on Gaming Mice,2025-03-11T17:01:01Z,998112,34633,28,3620
This GPU scam is Almost Impossible to Detect,2025-03-10T18:52:32Z,1813688,60687,28,3536
I bought a PC from Walmart… Again,2025-03-08T16:00:46Z,1436052,48614,28,1993
"Lies, Damned Lies, And Then MSRP - WAN Show March 7, 2025",2025-03-08T03:17:41Z,461708,9451,28,1033
Can You Identify the Imposter?,2025-03-07T19:39:00Z,1413765,40611,28,604
I Bought a Mac at the WRONG Time - Apple Air Event,2025-03-06T22:01:25Z,1637539,44777,28,2205
"AMD, I Could Kiss You - 9070 and 9070 XT Review",2025-03-05T14:00:48Z,2474270,94529,28,7052
This is a 4090 Killer… and I’m a Liar - RTX 5070 Review,2025-03-04T14:00:00Z,2087585,70943,28,4915
Remaking Our Most Hated Video - Pizza Warming PC V2,2025-03-02T18:07:34Z,1167683,56312,28,2051
"My Mac Transition Is Not Going Well - WAN Show February 28, 2025",2025-03-01T06:05:02Z,678597,11758,28,1720
AMD Out Here Saving Gaming - RX 9070 and 9070 XT Announcement,2025-02-28T14:07:11Z,1927956,73535,28,4826
How to Build the Ultimate $69 Gaming PC!,2025-02-27T18:42:07Z,1482645,57749,28,3347
My Framework Investment Should NOT Have Worked Out,2025-02-25T19:14:20Z,1928185,79400,28,5460
PC Guy Shops for a MacBook,2025-02-23T17:09:42Z,2074211,65739,28,4040
Should We Cancel Our 5090 Pre-orders? - 4K Gaming Test,2025-02-22T18:13:33Z,1433064,44974,28,4857
"HP Nerfs Their Tech Support ON PURPOSE - WAN Show February 21, 2025",2025-02-22T04:57:01Z,466310,8457,28,987
Linus' Greatest Tech Mistake...,2025-02-21T18:00:55Z,295753,13694,28,336
The iPhone 16e Shows why Apple Bought Part of Intel,2025-02-20T13:21:39Z,1622513,49506,28,3900
Nvidia Didn’t Want to Make the RTX 5070 Ti - Full Review,2025-02-19T14:00:11Z,1295074,42469,28,3568
We Bought MOVIES on VINYL RECORDS and They’re AMAZING - SelectaVision CED VideoDisc,2025-02-17T18:00:41Z,1703968,54828,28,2756
8K Gaming is NEVER Happening - RTX 5090 Demo,2025-02-15T18:11:59Z,2809817,79740,28,6381
"Cables Aren’t Supposed To Melt, Right? - WAN Show February 14, 2025",2025-02-15T04:04:40Z,515578,10291,28,1177
I hate AI.,2025-02-14T18:00:43Z,802528,50627,28,1128
Our New $4500 Workstation PCs for Editing,2025-02-13T22:05:41Z,631343,13142,28,729
Reacting to INSANE Chinese Gaming Setups,2025-02-12T18:20:26Z,1146799,44601,28,1802
17 Minutes of LTT Complaining About Computers,2025-02-11T19:01:44Z,1222168,60506,28,4453
I Made a Personal VPN to Access EVERYTHING… and You Can Too!,2025-02-09T18:22:08Z,1092890,44629,28,1764
I Forced 3 iPhone users to Switch to Android - 30 Day Android Challenge Pt.1,2025-02-08T17:56:38Z,3039427,110043,28,8994
"My Business Is In Danger - WAN Show February 7, 2025",2025-02-08T05:48:46Z,729303,12599,28,1694
I Painted his House to Fix his WiFi,2025-02-05T18:02:22Z,2096663,64365,28,3625
The ULTIMATE Sleeper Gaming TV,2025-02-04T18:18:17Z,2004905,127349,28,3993
The $300 GAMING PC Challenge - The Original Scrapyard Wars COMPLETE,2025-02-03T18:48:20Z,587497,23450,28,1921
Find the FAKE PC Gamer,2025-02-01T17:24:19Z,782309,39163,28,3185
"Does What We Do Even Matter? - WAN Show January 31, 2025",2025-02-01T03:53:18Z,544724,11638,28,1592
I Can’t Put a Positive Spin on the RTX 5080 - Full Review,2025-01-29T14:00:35Z,2430701,64570,28,5848
Do LTT Staff Actually Have Good Computers at Home??,2025-01-28T18:09:06Z,1133822,39344,28,1692
The Hunt for the BEST Controller (Hall Effect),2025-01-27T18:00:23Z,1795206,56541,28,5901
The LTT staff shows off their Latest Tech Purchase,2025-01-25T17:54:37Z,1127316,42887,28,2202
"I Just Wanna Do Tech Tips - WAN Show January 24, 2025",2025-01-25T05:28:09Z,738845,18970,28,4769
Ask me Anything!,2025-01-24T21:11:50Z,150655,6741,28,1871
The RTX 5090 - Our Biggest Review Ever,2025-01-23T14:00:05Z,3206353,101365,28,9014
The Latest Celebrity Tech Scam…,2025-01-21T18:10:33Z,2869649,104750,28,8860
EVERY AMD Ultimate Tech Upgrade! 2024 Edition!,2025-01-19T17:52:38Z,254481,8401,28,588
I Hate Nintendo and I’m Buying a Switch 2 IMMEDIATELY,2025-01-18T08:35:23Z,4518848,120785,28,7921
Color Changing Tech Glasses,2025-01-18T05:20:00Z,743040,30019,28,683
"Breaking My Silence - WAN Show January 17, 2025",2025-01-18T04:55:53Z,1066135,30247,28,4892
Honest Trailers | Snowpiercer,2025-03-11T17:00:55Z,331460,13689,1,938
Honest Trailers Teaser - Snowpiercer,2025-03-10T19:00:04Z,16962,603,1,33
Honest Trailers | Daredevil (Series),2025-03-04T18:00:41Z,556571,24729,1,1698
Honest Trailers | The Oscars 2025 (Best Picture Nominees),2025-02-25T18:00:50Z,555236,17937,1,1507
Honest Trailers | Harry Potter and the Sorcerer's Stone,2025-02-18T18:24:16Z,605462,26262,1,2349
Honest Trailers | Captain America 1979,2025-02-11T18:00:00Z,463151,17147,1,1658
Honest Trailers | Gladiator 2,2025-02-04T18:00:36Z,654383,23081,1,1764
Honest Trailers | Sonic the Hedgehog 3,2025-01-28T18:00:38Z,579318,22711,1,1827
Honest Trailers | Kraven the Hunter,2025-01-21T18:00:22Z,946533,27747,1,1682
Honest Trailers | Squid Game (Season 2),2025-01-14T18:00:43Z,664267,20460,1,1232
Honest Trailers | The Best Movies Ever,2025-01-07T18:00:22Z,335505,6828,1,478
The Year in Movies: 2024 Supercut,2024-12-31T18:00:39Z,106197,4104,1,354
Honest Trailers | Red One,2024-12-24T18:00:36Z,845915,27118,1,1856
Honest Trailers | Venom: The Last Dance,2024-12-17T18:51:19Z,673767,21615,1,1155
Honest Trailers | The Hobbit (1977),2024-12-10T18:00:04Z,742539,28881,1,2125
Honest Trailers | Kick-Ass,2024-12-03T18:00:07Z,729402,27507,1,1430
Honest Trailers | The Penguin,2024-11-26T18:00:39Z,737494,24541,1,1221
Honest Trailers | Megalopolis,2024-11-19T18:00:35Z,780742,22838,1,1903
Honest Trailers | The Wizard of Oz,2024-11-12T18:00:37Z,846241,30259,1,2128
Honest Trailers | Joker: Folie à Deux,2024-11-05T18:00:20Z,1244602,41382,1,2720
Honest Trailers | The Wicker Man,2024-10-29T17:00:23Z,332002,14106,1,799
Robots Made By Weyland - Yutani Are No Good | Alien: Romulus Honest Trailer #trailer #entertainment,2024-10-25T17:19:07Z,33679,826,1,24
It's Almost Something New | Alien: Romulus Honest Trailer #trailer #entertainment #movie,2024-10-23T14:51:20Z,37201,1028,1,18
Honest Trailers | Alien: Romulus,2024-10-22T17:00:36Z,704861,25605,1,1640
Some Things Never Change | Beetlejuice Beetlejuice Honest Trailer #trailer #entertainment,2024-10-18T13:00:19Z,44364,1257,1,20
Get Ready for His Final Destination | Beetlejuice Beetlejuice Honest Trailer #trailer #entertainment,2024-10-16T15:02:07Z,28103,725,1,3
Honest Trailers | Beetlejuice Beetlejuice,2024-10-15T17:00:00Z,690251,26204,1,1351
But Feige Said It's Off Limits! | Deadpool & Wolverine Honest Trailer #trailer #entertainment,2024-10-11T13:00:19Z,36012,1123,1,18
Deadpool's Next Adventure! | Deadpool & Wolverine Honest Trailer #trailer #deadpoolandwolverinemovie,2024-10-09T14:35:40Z,28689,1180,1,23
Honest Trailers | Deadpool & Wolverine,2024-10-08T17:00:31Z,1763185,66219,1,3737
"Don't miss our Joker: Folie à Deux Livestream on @fandomentertainment   Monday, Oct 7 at 12pm PST",2024-10-04T17:35:45Z,22268,320,1,18
"Gotta Have More Cowbell, Baby! | Whiplash Honest Trailer #trailer #entertainment #movie",2024-10-04T13:00:58Z,16278,450,1,13
Senpai Finally Noticed! | Whiplash Honest Game Trailer #trailer #entertainment #movie,2024-10-02T14:39:02Z,24981,716,1,8
Honest Trailers | Whiplash,2024-10-01T17:01:01Z,492578,20780,1,1200
