Title,Published_date,Views,Likes,Categories,Comments
"Take Good Care of It, Kid. | The Iron Giant Honest Trailer #trailer #entertainment #movie",2024-09-27T16:18:31Z,29357,825,1,10
Before He Was a Car Jesus... | The Iron Giant Honest Trailer #trailer #entertainment #movie,2024-09-25T16:44:51Z,25922,905,1,13
Honest Trailers | The Iron Giant,2024-09-24T17:00:43Z,423759,23037,1,1348
You Know What? Don't Answer That... | Inside Out 2 Honest Trailers #trailer #entertainment,2024-09-20T13:00:59Z,29184,717,1,16
New Ideas Are For Poor People! | Inside Out 2 Honest Trailers #trailer #entertainment,2024-09-18T14:52:06Z,25828,929,1,21
Honest Trailers | Inside Out 2,2024-09-17T17:00:46Z,626453,21913,1,1120
The First Rule of Screenwriting. | Borderlands Honest Trailers #trailer #entertainment,2024-09-13T17:25:55Z,47510,1034,1,26
Stitched together by poop jokes and sadness | Borderlands Honest Trailers #trailer #entertainment,2024-09-11T14:43:12Z,43398,959,1,45
Honest Trailers | Borderlands,2024-09-10T17:00:11Z,733008,30260,1,1867
Worth a Shot... | Beetlejuice Honest Trailer #trailer #entertainment,2024-09-06T18:46:42Z,30534,753,1,24
"You know him, just don't want to meet him | Beetlejuice Honest Trailer #trailer #entertainment",2024-09-04T16:53:32Z,24806,924,1,10
Honest Trailers | Beetlejuice,2024-09-03T17:00:17Z,682920,28181,1,1457
In Today's World Nothing Is Allowed to Die | Twisters Honest Trailer #trailer #entertainment,2024-08-29T17:58:47Z,42421,1153,1,13
Honest Trailers | Twisters,2024-08-27T17:00:30Z,648451,21238,1,1409
Honest Trailers | The Crow,2024-08-20T17:00:26Z,666373,31062,1,2177
Coen Brothers are Always a Right Choice | House of the Dragon Season 2 Honest Trailer #trailer,2024-08-16T12:00:34Z,30528,598,1,9
"Zodiac Isn’t Sure Who The Real Killer Is, But David Fincher Might Be | CineFix Top 100",2025-03-09T13:15:06Z,16092,413,1,93
Top 10 Movie Mysteries of All Time | A CineFix Movie List,2025-02-16T14:32:00Z,127050,4066,1,378
Top 10 Apocalypse Movies of All Time | A CineFix Movie List,2025-01-26T15:00:12Z,128212,4588,24,488
Wolf Man Director Leigh Whannell Picks His Favorite Shots from His Career | My Best Shots,2025-01-15T14:01:07Z,10871,473,24,40
Top 10 Movies of 2024 | A CineFix Movie List,2024-12-29T14:30:04Z,336778,9246,1,676
Die Hard Is The Sequel To The Book Seven Samurai Wrote On Action | CineFix Top 100,2024-12-22T14:00:00Z,17454,575,1,146
"Robert Eggers Picks His Favorite Shots from Nosferatu, The Witch, and More | My Best Shots",2024-12-20T14:00:10Z,258753,6275,24,226
Planet of the Apes HAD to Star a Big Old Jerk | CineFix Top 100,2024-12-15T14:00:52Z,13350,407,1,81
The Truman Show Makes You Its Main Character | CineFix Top 100,2024-12-08T14:15:00Z,18180,520,24,116
The Dark Knight’s Best Line of Dialogue Is Coming True | CineFix Top 100,2024-12-01T14:00:20Z,21122,589,1,235
Toy Story Is One of the Most Consequential Movies Ever Made | CineFix Top 100,2024-11-17T15:00:05Z,14772,496,24,108
The 3 Secrets to a Ridley Scott Battle Scene,2024-11-15T15:01:00Z,13848,626,1,31
One of Us Does NOT Like Kill Bill Vol. 1 | CineFix Top 100,2024-11-10T15:01:01Z,16770,506,24,128
OSS 117 Is Pitch Perfect Connery Era Bond Parody | CineFix Top 100,2024-11-03T14:15:05Z,12701,367,24,78
Alien is a B-Movie Done In an A+ Way | CineFix Top 100,2024-10-27T13:15:08Z,20538,641,24,111
The Naked Gun Might Be The Last Great Spoof  | CineFix Top 100,2024-10-20T13:15:03Z,27784,660,1,200
Top 10 Political Films of All Time | A CineFix Movie List,2024-10-16T14:15:00Z,106367,4555,24,486
They Live is a B-Movie But the ‘B’ Stands for Brilliant | CineFix Top 100,2024-10-13T13:00:45Z,18756,644,1,114
Anchorman's Greatest Gift to Cinema Is How Quotable It Is | CineFix Top 100,2024-10-06T13:01:10Z,16090,459,24,103
"John Wick Showed Hollywood How to Save Itself, But No One Paid Attention",2024-10-02T17:32:36Z,117109,3933,24,328
Ikiru Isn’t The First Kurosawa You Think Of (But Maybe It Should Be) | CineFix Top 100,2024-09-29T14:00:29Z,11529,347,1,61
Francis Ford Coppola Picks His Favorite Shots From His Most Iconic Movies | My Best Shots,2024-09-27T12:00:02Z,39173,1187,1,59
Uncut Gems Is Peak ‘New York Dirtbag’ Cinema | CineFix Top 100,2024-09-22T14:00:44Z,15010,414,24,105
Blade Runner 2049 Is The Artsiest Big Budget Sci Fi Can Get | CineFix Top 100,2024-09-15T14:00:02Z,23863,847,24,149
CineFix Top 100 Is BACK For Season 3,2024-09-11T14:00:23Z,7637,362,1,45
Beetlejuice Goes Hawaiian: The Bonkers Sequel We Almost Got,2024-09-03T16:30:11Z,31519,1192,24,131
When Exactly Did The Alien Movies Stop Being About Space Truckers?,2024-08-19T14:00:28Z,75282,2472,24,281
"Doug Liman Picks His Favorite Shots From The Instigators, Mr. and Mrs. Smith, & More | My Best Shots",2024-08-02T14:00:52Z,20270,659,24,48
"MaXXXine Director Ti West Picks His Favorite Shots From X, Pearl, The House of the Devil and More",2024-06-28T13:30:26Z,39153,898,1,36
Top 10 Buddy Cop Movies of All Time,2024-06-11T23:06:40Z,70312,2249,24,499
Le Samouraï is The Original ‘Cool’ Hit Man w/ Director Richard Linklater | CineFix Top 100,2024-06-02T13:00:24Z,24825,480,1,54
War Rigged: How Mad Max Pulled Off Five Decades of Mayhem,2024-05-31T13:00:45Z,24261,873,24,81
"George Miller Picks His Best Shots From His Most Iconic Movies (Mad Max, Furiosa, Babe)",2024-05-20T16:19:28Z,70191,2121,24,109
"Greig Fraser Picks His Best Shots From His Most Iconic Movies (Dune, The Batman, Rogue One)",2024-05-16T13:00:07Z,93261,3444,1,100
"David Leitch Picks a Favorite Shot From Each of His Movies (Deadpool 2, John Wick) | My Best Shots",2024-05-03T13:36:12Z,30763,862,24,24
Boogie Nights Is A Perfect Horny Boy Family Movie | CineFix Top 100,2024-04-28T13:00:09Z,21046,460,1,87
Jaws Might Be The Luckiest Mistake In Movie History | CineFix Top 100,2024-04-21T14:15:01Z,28709,689,24,156
"The Warriors Is Sweaty, Grainy, Dirty and Awesome | CineFix Top 100",2024-04-14T13:00:23Z,19654,522,24,130
Alex Garland Picks a Favorite Shot From Each of His Most Iconic Movies | My Best Shots,2024-04-08T14:00:34Z,61138,1613,24,61
La Haine Is Tough Guy Posturing At Its Finest | CineFix Top 100,2024-04-07T15:00:01Z,14858,376,24,79
Hot Fuzz Is A Buddy Cop Love Story | CineFix Top 100,2024-03-31T13:15:05Z,28050,700,24,122
"Princess Mononoke Is Beautiful, But Does It Have Rizz? | CineFix Top 100",2024-03-24T15:00:45Z,19475,545,24,276
Prince Ashitaka vs  Robin Hood v1,2024-03-23T14:00:04Z,15469,279,1,43
Being There Is Cinema’s Greatest Rorschach Test | CineFix Top 100,2024-03-17T15:00:44Z,19431,431,24,101
The ‘Burbs Taps Into Every Suburban American’s Fear | CineFix Top 100,2024-03-10T13:00:20Z,16272,388,24,107
Top 10 International Feature Oscar Winners of All Time,2024-03-08T14:00:29Z,68365,2075,24,231
Rear Window Is Hitchcock’s Most Technically Impressive Film | CineFix Top 100,2024-03-03T14:00:08Z,23445,633,24,116
Denis Villeneuve Picks a Favorite Shot From Each of His Most Iconic Movies | My Best Shots,2024-02-26T15:00:03Z,709052,19368,24,639
Monty Python And The Holy Grail Gleefully Skewers The Filmmaking Process | CineFix Top 100,2024-02-25T14:15:04Z,29356,685,24,158
Disney’s Robin Hood: What The F*** Is This Doing Here? | CineFix Top 100,2024-02-18T14:15:06Z,27005,594,24,203
What is sex?: Sex Ed #1,2025-03-13T16:00:35Z,203374,5702,27,165
Crash Course Sex Ed Preview,2025-03-06T17:01:00Z,117652,4872,27,194
Religions and Pop Culture: Crash Course Religions #24,2025-03-04T17:00:19Z,81577,5749,27,306
What Does Religious Freedom Mean?: Crash Course Religions #23,2025-02-25T17:00:04Z,80265,5038,27,73
Visions of the End of the World: Crash Course Religions #22,2025-02-18T17:01:19Z,107230,5819,27,91
The Power of Political Recognition,2025-02-13T17:00:11Z,37168,2435,27,56
What Does Race Have to Do with Religion?: Crash Course Religions #21,2025-02-11T17:00:36Z,84941,5520,27,0
Should Art Be Political?,2025-02-06T17:00:43Z,41809,2326,27,120
What Do Sex and Gender Have to Do with Religion?: Crash Course Religions #20,2025-02-04T17:00:09Z,130331,7471,27,0
Is Utopia Actually Possible?,2025-01-30T17:01:05Z,55729,2938,27,89
Are Science and Religion Compatible?: Crash Course Religions #19,2025-01-28T17:00:41Z,109624,6058,27,0
Philosophies of Punishment & The Prison Abolition Movement,2025-01-23T17:00:58Z,62170,3376,27,163
"Religion, Spirituality, and the Supernatural: Crash Course Religions #18",2025-01-21T19:15:01Z,96199,5277,27,57
Political Cosmopolitanism,2025-01-16T17:01:10Z,57922,3038,27,75
Death and Afterlife Across Religions: Crash Course Religions #17,2025-01-14T17:00:47Z,124265,6755,27,87
"What is Feminism, and Where Does it Go From Here?",2025-01-09T17:00:05Z,70578,4001,27,164
Who Speaks for a Religion?: Crash Course Religions #16,2025-01-07T17:01:02Z,96432,5186,27,132
A World Without Governments? Anarchism Explained,2025-01-02T17:00:23Z,185898,10727,27,531
Who Was Karl Marx? And Why Is Everyone Still Talking About Him?,2024-12-19T17:00:07Z,204131,10374,27,550
What Does Ritual Have to Do with Religion?: Crash Course Religions #15,2024-12-17T17:00:50Z,92487,5096,27,35
What does Machiavellian mean?,2024-12-12T17:00:40Z,94944,4967,27,188
How Do Religious Texts Work?: Crash Course Religions #14,2024-12-10T17:00:16Z,127738,6523,27,81
What Are the Rules of War? Just War Theory,2024-12-05T17:00:33Z,77570,3509,27,169
Is Atheism a Religion?: Crash Course Religions #13,2024-12-03T17:00:18Z,179116,9967,27,45
"Confucianism, Buddhism, and Daoism: Chinese Popular Religion",2024-11-26T17:00:11Z,163459,7711,27,66
"Identity politics: the good, the bad, and the… hotly contested",2024-11-21T17:00:18Z,73530,3183,27,74
Religions of the African Diaspora: Crash Course Religions #11,2024-11-19T17:00:42Z,149064,7789,27,92
What Does Liberalism Mean?,2024-11-14T17:00:40Z,88804,4212,27,73
The History and Practice of Islam on Earth and Beyond: Crash Course Religions #10,2024-11-12T17:01:02Z,214807,11107,27,0
"Where Did Democracy Come From, and Does It Still Work?",2024-11-07T17:00:58Z,100187,5355,27,26
"Sacrifice, Redemption, and Miracles: The Story of Christianity: Crash Course Religions #9",2024-11-05T17:01:04Z,210018,8961,27,87
Crash Course Political Theory Preview,2024-10-31T16:00:23Z,82093,4561,27,129
What Does it Mean to Be Jewish: Crash Course Religions #8,2024-10-29T16:00:40Z,254263,10487,27,0
Can a River Be A Person? | Indigenous Traditions: Crash Course Religions #7,2024-10-22T16:00:09Z,123106,6761,27,57
"Life, the Universe, and the Buddha: Crash Course Religions #6",2024-10-15T16:00:40Z,222083,10270,27,158
The Infinite Stories of Hinduism: Crash Course Religions #5,2024-10-08T16:00:40Z,237434,10953,27,0
What’s the Difference Between Religion and Magic? | Crash Course Religions #4,2024-10-01T16:00:07Z,205724,11644,27,74
What is the Future of Art?,2024-09-26T16:00:42Z,47601,2412,27,98
What's the Difference Between Cults and Religion?: Crash Course Religions #3,2024-09-24T16:00:05Z,370580,20165,27,455
"The Importance of Preserving, Restoring, & Conserving Art",2024-09-19T16:00:52Z,60188,2817,27,53
How Many Religions Are There?: Crash Course Religions #2,2024-09-17T16:00:25Z,221335,11659,27,140
Does Defacing Art = Activism?,2024-09-12T16:00:26Z,50929,2629,27,21
How It All Ends | Crash Course Pods: The Universe #11,2024-09-11T15:01:12Z,50784,1691,27,228
What Even IS a Religion?: Crash Course Religions #1,2024-09-10T16:00:05Z,250176,15492,27,310
Why Is Art So Expensive?,2024-09-05T16:00:12Z,52698,2257,27,44
Making of Crash Course: Live Sound Design with the Team! #Learnathon2024,2024-09-04T18:05:03Z,16844,295,27,3
Crash Course Religions Preview,2024-09-03T16:00:26Z,241972,18444,27,812
Is AI-Generated Art Original? (Authenticity & Originality),2024-08-29T16:00:24Z,62132,2831,27,104
The Future | Crash Course Pods: The Universe #10,2024-08-28T17:30:01Z,41348,1360,27,109
"Graffiti, Street Art & Murals: What We Learn from Public Art",2024-08-22T16:01:04Z,55123,2262,27,43
The greenest pasta you’ve ever seen!,2025-03-12T13:22:04Z,108694,7058,22,92
How to REALLY chop an onion,2025-02-28T13:48:49Z,346259,17787,22,71
The secret to making tofu irresistible,2025-02-21T14:54:07Z,320482,18149,22,128
"The truth about ""the perfect partner”",2025-02-12T15:35:28Z,433879,28313,22,217
Flakey pastry you MUST try (just 7 ingredients!) 🤤,2025-01-31T13:41:07Z,135863,6674,22,62
The BEST fudgiest brownies (egg-free + dairy-free!),2024-12-08T16:24:24Z,169196,9021,22,252
One-pot WEEKNIGHT meals | batch-friendly!,2024-11-24T16:06:59Z,431909,16461,22,266
The most popular Persian soup (high protein!),2024-11-19T17:40:53Z,593606,29808,22,299
Skip the café — make this at home! ☕️💫,2024-11-07T16:22:26Z,284360,15821,22,104
The best way to use up leftover rice 🍚,2024-10-20T15:33:03Z,1843673,59643,22,470
"The BEST Bakery-Style Chocolate Chip Cookies (egg-free, dairy-free!) 🍪",2024-10-10T15:18:01Z,379058,15433,22,471
MEAL PREP | 10 healthy meals in 1 HOUR (+ PDF guide),2024-09-26T15:16:23Z,1049761,37950,22,882
10 life lessons (for a healthy mind + body) ✨,2024-09-08T15:19:08Z,564111,31194,22,1092
the weirdest coffee combo… that works! 😎,2024-08-30T13:10:31Z,419740,20350,22,142
the ultimate CURRY NOODLE SOUP (ft.@RainbowPlantLife),2024-08-18T15:00:06Z,237038,11261,22,498
This mindset helped me more than once 💭,2024-08-06T14:27:57Z,2019620,108927,22,665
HIGH PROTEIN MEALS | 30g+ protein meals for 30 days!,2024-08-04T15:39:18Z,591544,23926,22,513
POTATO SALADS - 3 ways!,2024-06-23T16:09:47Z,363380,19228,22,337
the BEST meals 🤤,2024-05-19T15:11:50Z,447747,23559,22,154
How to enjoy chopping veggies 🔪🥕,2024-05-01T18:31:07Z,1418966,63628,22,434
Why THIS is my favourite cuisine 💛,2024-04-24T15:25:34Z,4823621,196107,22,1676
ONE SIMPLE HABIT to improve any relationship ❤️,2024-04-16T15:49:26Z,588787,32664,22,819
Your new FAVORITE salad,2024-04-09T14:30:29Z,961222,67784,22,355
PASTA perfect for weeknight dinner (plant-based) 🍝,2024-03-28T15:44:35Z,221837,9677,22,221
"7-ingredient meals (minimal ingredients, MAX flavor) 7️⃣ 🎉",2024-03-10T16:06:32Z,275840,13500,22,364
"Level-up your LUNCH (plant-based, make-ahead, to-go) 🌟",2024-02-25T15:37:47Z,387610,15930,22,304
A day in the life (on our road trip adventure!) 🚐🦘,2024-02-11T16:48:04Z,253277,12752,22,594
High protein anti-inflammatory noodle soup (aush reshteh) 👩🏻‍🍳,2024-01-28T16:36:51Z,915911,35747,22,823
"ONE-POT meals (plant-based, easy, cozy)",2024-01-14T17:06:10Z,484300,19380,22,467
Easy NO-BAKE treats (perfect for the holidays) 🎄,2023-12-10T17:11:51Z,316356,16075,22,329
Full day of easy home-cooked meals 🎉,2023-11-30T17:01:27Z,575601,20294,22,6656
Micro habits that improved my life ✨,2023-11-12T16:07:12Z,1043426,39486,22,755
The BEST cucumber salad 🥒,2023-10-29T16:31:28Z,2082703,95056,22,555
Become better at talking to people 🗣️,2023-09-28T14:28:05Z,1289839,69684,22,992
If I could make only 1 noodle dish for the rest of my life… 🥢,2023-09-10T14:36:06Z,820887,40241,22,694
Easy STUDENT recipes (MEAL PREP friendly!) 🍱,2023-08-27T15:27:05Z,756134,31107,22,377
"A WEEK IN MY LIFE | cooking, cleaning, and computer disaster 🫣",2023-08-06T13:57:34Z,371521,11631,22,502
SLEEP BETTER with these evening snacks 😴,2023-07-18T14:35:11Z,941862,38290,22,592
Plant-based MEAL PLANNING | Nourish Method tutorial 🌈,2023-07-01T16:00:42Z,255440,13155,22,1288
A full day of easy at-home meals 🍜,2023-06-25T15:48:38Z,615590,22656,22,5725
"DAYS IN THE LIFE | home alone, it's just you and me 😉",2023-06-06T15:31:24Z,552111,22331,22,1126
15-minute meals when you don’t feel like cooking (8 ingredients or less!),2023-05-21T15:00:32Z,662804,31727,22,441
How to find meaning (in an fast-changing world 🤖),2023-05-04T14:51:47Z,188529,9842,22,497
PANCAKES from around the world (eggless & dairy-free!) 🌎,2023-04-15T14:25:42Z,266913,13184,22,594
Master SPICES & HERBS (antioxidant powerhouses!) 🌶️🌿,2023-03-30T14:41:39Z,232161,12585,22,356
The biggest barrier to happiness + success 🫠,2023-03-07T17:07:15Z,470560,22404,22,606
3 weeknight DINNER ideas (plant-based!)💡,2023-02-23T16:21:17Z,484295,21043,22,341
3 easy BREAKFASTS to keep on REPEAT! ♻️,2023-02-09T15:27:28Z,607072,26046,22,650
Life is short (how to spend it wisely) ⏱,2023-01-24T15:02:53Z,1651194,58375,22,1463
The ROUTINE that makes me happy & effective ✔️,2023-01-12T17:00:06Z,759475,33369,22,567
"Best Mobiles Under ₹10,000 || March 2025 ||",2025-03-15T15:30:16Z,92105,7983,28,416
IOS 18.4 🍎🍎🍏🍏 Useful Features I in Telugu ||,2025-03-15T10:40:56Z,100013,11292,28,81
"Tech News 1926 || OnePlus 13 Mini, Samsung Gaming XR Headset, POCO F7 Series, Starlink India Etc..",2025-03-14T14:34:06Z,147393,11303,28,443
"Tech News 1925 || Vivo X200 Ultra in India, Moto Edge 60 Fusion, Airpods Pro 3 Launch, OPPO F29 Etc",2025-03-13T14:41:06Z,147592,10870,28,412
ఇలాంటి వెదవలు ఎక్కువై పోతున్నారు || #prasadtechintelugu #betting Cricket Betting Scams,2025-03-13T10:43:15Z,678013,76534,28,290
"Tech News 1924 || Xiaomi 15 Series , Airtel  X JIO X Starlink Satellite internet, Moto Edge 60  Etc.",2025-03-12T14:40:05Z,164234,11686,28,410
తక్కువలో  IPL చూడండి 🏏|| JioHotstar2025 subscription at lowest price..#IPL2025 #JioHotstar #JioPlans,2025-03-12T11:22:47Z,540730,55852,28,2148
iQOO Neo 10R Unboxing & initial Impressions || Best Gaming Phone Under 25k ? ||,2025-03-11T11:30:13Z,299583,20931,28,697
"Tech News 1923 || POCO F7 Pro in India,Realme P3 Series Launch,Instagram Community Chat,Youtube.Etc.",2025-03-10T15:03:02Z,184724,12542,28,516
DSLR Camera & Charger అవసరం లేదు || MWC 2025 Highlights || Prasad Tech In Telugu ||,2025-03-08T14:46:18Z,156918,10395,28,273
"Tech News 1922 || Google Pixel 9a Launch, iPhone 17 Air leaks ,Realme P3 Ultra, JioHotstar .Etc..",2025-03-07T15:04:55Z,182928,12246,28,496
Reels ఇలా కూడా చూడొచ్చా 🫣😂 ? #reels #instagram #instareels #trending  #prasadtechintelugu,2025-03-07T11:14:47Z,498201,58595,28,259
"Tech News 1921 || Macbook Air M4 & Mac Studio's Launched, Galaxy Book 5 series & Z Flip 7 Etc",2025-03-06T14:41:54Z,166767,10871,28,377
"Tech News 1920 || iPad Air M3 & iPad A16 Launched, Galaxy S25 Edge, OnePlus 13&13R Updates Etc..",2025-03-05T14:45:01Z,179314,12193,28,470
"ఫైనల్కెళ్తున్నాం ,కప్పు🏆 కోడుతున్నాం😉||Compare grocery prices😁#Swiggyinstamart  #BigBasket#trending",2025-03-05T10:43:22Z,728406,73368,28,171
Nothing Phone 3a Pro & 3a Unboxing & Initial Impressions || ft. Nothing Phone 3a Series || in Telugu,2025-03-04T10:30:31Z,546516,28163,28,1026
Samsung Galaxy A56 Unboxing & initial impressions || in Telugu ||,2025-03-03T16:43:03Z,220869,12263,28,386
"Tech News 1919 || Xiaomi 15 Series launch,Moto Edge 60 Fusion & Edge 60 Pro,Macbook air M4.Etc..",2025-03-03T14:45:04Z,162909,12201,28,383
Lenovo Yoga Slim 7i Aura Edition Unboxing & Initial Impressions || in Telugu ||,2025-03-01T14:50:41Z,80113,5435,28,213
iPhone 16e Unboxing & initial impressions || Prasad Tech in Telugu ||,2025-03-01T02:30:22Z,589354,23093,28,482
"Tech News 1918 || Apple Upcoming Launches,Z Flip 7,Infinix Trifold,Airtel SA 5G,POCO F7 Launch.Etc..",2025-02-28T14:45:02Z,209146,13862,28,379
iPhone ని Telugu భాష లో వాడండి ||#prasadtechintelugu #iphone #18.4update #trending #viralshorts,2025-02-28T10:31:17Z,226152,22014,28,133
Upcoming Mobiles in March 2025 || in Telugu,2025-02-27T14:30:43Z,247575,14233,28,697
"Tech News 1917 || Samsung Tri Fold,CMF Phone 2,Airtel IPTV Service,Digital Mahakumbh.Etc..",2025-02-26T14:45:00Z,178859,12041,28,388
"Tech News 1916  || Realme Ultra DSLR Phone, Pixel 9a , Nothing Phone 3, Champions Trophy Etc.",2025-02-25T14:47:51Z,137669,11428,28,395
AI యుద్ధం || Samsung Galaxy AI VS Apple Intelligence || Prasad tech in telugu ||,2025-02-25T09:23:57Z,157015,9158,28,368
"Tech News 1915 || Samsung S25 Edge, iPhone 15 Pro Visual Intelligence, Deepfake, Flying Cars.Etc.",2025-02-24T14:45:00Z,236949,14195,28,386
Macbook Pro M4 Chip review || in Telugu || Prasadtechintelugu,2025-02-22T14:25:00Z,107918,6271,28,259
పోతారు - మొత్తం పోతారు ||  Instagram Reel Sharing New Trick 🫣 || #prasadtechintelugu  #trending,2025-02-22T10:22:08Z,328470,36649,28,113
"Tech News 1914 || Oppo Find N5 Launched, iPhone 16e, One UI 7, Muse AI, Google Pay Charges Etc..",2025-02-21T14:48:39Z,179079,12015,28,403
"Tech News 1913 || iPhone 16e Launched, Free Grok 3,Circle to search in iPhone, Free Fire VS PUBG Etc",2025-02-20T15:52:51Z,159900,12950,28,396
"Tech News 1912 || Nothing Phone 3a, Grok AI 3, Samsung Log Feature, JioTele OS, Mahakubh Scam .Etc..",2025-02-19T15:38:18Z,178677,12147,28,374
"Tech News 1911 || Moto Razr 60,OnePlus 13 Mini,Apple Humanoid Robo,Tesla Hiring,Nothing Phone 3a.Etc",2025-02-18T14:52:18Z,172891,12145,28,379
మనిష  పశువా 👀 ||  Zomato New Order Schedule Feature || #prasadtechintelugu,2025-02-18T11:20:38Z,463803,60075,28,107
realme P3 Pro Unboxing & Impressions || Quad Curve Display 🔥|| 90FPS Gaming ⚡️,2025-02-18T06:50:48Z,253607,13919,28,358
"Tech News 1910 || Xiaomi 15 Series Launch Date, OnePlus Magic Cube Key, BSNL 5G, JioHotstar IPL, Etc",2025-02-17T13:44:00Z,193395,12872,28,407
vivo V50 Unboxing & Initial Impressions || in Telugu,2025-02-17T07:18:49Z,341373,17634,28,506
Best Mobiles Under 25K in Telugu  || Feb 2025 ||,2025-02-15T14:40:03Z,335041,19009,28,744
ఆత్రంగా తినకండి🥵#Trending #ViralFood #Food #Foodshort#prasadtechintelugu #viralshorts,2025-02-15T11:29:50Z,298937,31455,28,129
"Tech News 1909 || iPhone 16E launch Date, Nothing Phone 3a, JioHotstar Merger, One UI 7 Update Etc..",2025-02-14T14:55:02Z,223898,13159,28,487
AI లో లోపాలు || #AI #modi #chatgpt #gemini #grok #metaai #prasadtechtelugu,2025-02-14T10:20:46Z,1130240,96738,28,551
"Tech News 1908 || Samsung Galaxy S25 Edge, Realme Neo7 & 7T, Apple TV on Android, JioHotstar Etc",2025-02-13T15:02:35Z,145298,10979,28,321
Greenline Prank 🤫 || #prasadtechintelugu #prasadtechshorts #greenline #prank #techshorts,2025-02-13T10:49:26Z,1180359,116267,28,184
"Tech News 1907 || Google I/O 2025 Dates, iPhone SE 4, Macbook air M4 launch,Apple Watch,BirdFlu Etc.",2025-02-12T15:00:14Z,248542,14316,28,396
"Tech News 1906 || Moto Razr Ultra 2025, OPPO Find N5, OnePlus Watch 3, Galaxy Watch 8 Classic Etc..",2025-02-11T14:49:08Z,151241,10816,28,501
"Tech News 1905 || OPPO Find N5 Launch, Moto Razr Ultra, Apple WWDC 2025,  Marriage & CIBIL Etc.",2025-02-10T15:08:38Z,136282,10490,28,369
ఉద్యోగస్తుల ప్రథమ లక్ష్యం || solution for Hyderabad Traffic 🚦 || #prasadtechtelugu #techshorts,2025-02-10T10:48:21Z,360408,43444,28,69
Oneplus 13 VS iQOO 13 || Prasad Tech in Telugu ||,2025-02-08T14:21:34Z,221965,12402,28,571
"Tech News 1904 || iPhone 16E launch, vivo V50, iQOO 12 updates, Zomato & Eternal Etc.",2025-02-07T15:11:54Z,190360,13453,28,463
"Tech News 1903 || OPPO Find N5 Launch, OnePlus 13 Mini, Flipkart Promise Protect Fee, Fastag Etc..",2025-02-06T15:04:06Z,177936,11167,28,342
How To Draw Spider-Man | Your Friendly Neighborhood Spider-Man | Disney+,2025-03-14T16:00:59Z,15706,2005,24,33
We are Groot 🥲🌿,2025-03-13T19:00:09Z,35469,4999,24,111
"“We’re alone in the world, each of us.”",2025-03-13T17:00:09Z,16600,2044,24,16
The Death of Gwen Stacy | Today in Marvel History,2025-03-13T15:00:28Z,450726,25026,24,1284
Daredevil: Born Again SPOILERS from the Cast and Crew!,2025-03-13T14:00:22Z,18440,1023,24,38
Marvel Television's Daredevil: Born Again | Episode 3 Now Streaming On Disney+,2025-03-12T01:00:18Z,24731,2973,24,73
We need him back.,2025-03-11T16:00:44Z,28565,3885,24,64
Marvel Television's Daredevil: Born Again | Rebirth and Death | Disney+,2025-03-10T16:00:49Z,103101,5577,24,442
Infinity Stones or Paper Weights?,2025-03-09T18:00:45Z,34200,3939,24,72
Yelena and Natasha being an iconic duo 👭🏻,2025-03-08T18:30:36Z,33399,3414,24,32
He's a really good lawyer.,2025-03-08T18:00:13Z,28150,4210,24,46
Marvel Television's Daredevil: Born Again | Save | Disney+,2025-03-08T17:01:00Z,168127,7325,24,265
ABSOLUTE CINEMA | MARVEL STUDIOS’ THUNDERBOLTS* | MAY 2,2025-03-08T00:00:29Z,2436204,113583,24,5980
"Sometimes, the peace needs to be broken.",2025-03-06T18:00:48Z,38258,4950,24,47
Infinity Stones in the MCU | Compilation,2025-03-06T18:00:47Z,549070,15420,24,451
Marvel Television's Daredevil: Born Again | Lights Out | Disney+,2025-03-06T17:01:24Z,137204,6139,24,327
Kingpin Returns in Daredevil: Born Again!,2025-03-05T17:01:02Z,30989,1312,24,66
Fight the darkness.,2025-03-05T17:00:59Z,41526,5725,24,84
To the fans who've been there every step of the way. ❤️,2025-03-04T23:00:02Z,32943,5701,24,195
A Conversation with Anthony Mackie and Harrison Ford | Captain America: Brave New World,2025-03-04T20:00:30Z,62781,2414,24,198
Marvel Television's Daredevil: Born Again | Tonight | Disney+,2025-03-04T17:00:02Z,296548,13193,24,572
Marvel Television's Daredevil: Born Again | Tomorrow | Disney+,2025-03-03T17:00:17Z,980749,31824,24,1511
Natasha and Yelena Best Moments | Compilation,2025-03-02T20:30:00Z,37499,2512,24,147
Avocados back at law.,2025-03-02T18:04:39Z,52850,5442,24,101
The greatest city on Earth.,2025-03-01T17:00:32Z,63566,7100,24,91
Captain America: Brave New World | Official Clip 'Cap VS Hulk',2025-02-28T20:00:39Z,524246,8790,24,834
Captain America: Brave New World | Behind the Scenes,2025-02-28T19:00:41Z,66895,2849,24,204
Marvel Television's Daredevil: Born Again | Meet | Disney+,2025-02-28T17:01:18Z,94406,5555,24,202
Captain America: Brave New World | Global Tour,2025-02-27T21:00:03Z,25771,2969,24,48
Groot's Sacrifice | Marvel Studios' Guardians of the Galaxy | Official Clip,2025-02-27T18:00:07Z,70730,1845,24,109
The rule of law must prevail,2025-02-27T18:00:01Z,61578,7328,24,154
