Title,Published_date,Views,Likes,Categories,Comments
"Chaar Kadam - Trending Version (Lyrics) | PK | Sushant Singh Rajput | Anushka Sharma | Shaan, Shreya",2025-03-16T12:30:03Z,1049,122,10,45
Khulle Aasmaan (Lyrical Video) - Juss | MixSingh | Reem Sameer Shaikh | Gurinder Bawa | T-Series,2025-03-16T11:01:18Z,19666,1194,10,136
"Beparwaiyaan (Full Audio): Digvijay Rathee, Shefali B | IP Singh,Rajarshi,Amar Jalal,Balla |Faridkot",2025-03-16T09:30:09Z,2887,177,10,46
JAANLEWA (Lyrical Video): Amrit Maan | Mxrci | Amyra Dastur | Bhushan Kumar,2025-03-16T05:30:58Z,61937,2588,10,195
Public Opinion On #TheDiplomat 🇮🇳 | John Abraham | Sadia | Shivam Nair | Bhushan K | In Cinemas Now!,2025-03-15T15:37:50Z,14255,454,10,28
"Jee Le Zaraa - Trending Version (Lyrics) | Talaash  | Aamir Khan |Rani Mukherjee,Kareena Kapoor Khan",2025-03-15T14:30:09Z,41505,1241,10,92
"Guzarish - Trending Version (Lyrics) | Aamir Khan | Asin | Ghajini | A.R. Rahman | Javed A, Sonu N",2025-03-15T13:31:29Z,80200,3137,10,256
CRAZXY: Yun Hi Chale Gaye (Lyrical Video) | Sohum Shah | K.S.Chithra | Osho Jain | Sarthak Kalyani,2025-03-15T12:30:35Z,4309,99,10,20
"Artiste: Roye Har Pal Dil Ye (Lyrical) | Santosh | Krisheka | Soniya | Suresh B | James K,Ratanrishi",2025-03-15T10:35:02Z,48254,1549,10,128
"The Diplomat (Review): High Commission of India, London | John Abraham | Sadia | Shivam | Bhushan K",2025-03-15T09:15:11Z,24802,324,10,29
"Happy Birthday 😍 #AliaBhatt | Wishing you a year filled with love, success, and endless joy! 🎉💖",2025-03-15T08:32:12Z,21076,506,10,16
Happiest Birthday to the #OG🔥 Yo Yo Honey Singh😍🔥| #YoYoHoneySingh #YTShortsIndia,2025-03-15T08:18:53Z,28825,2239,10,109
Fauji 2: Naina Bole (Song) | Ankita Lokhande | Shreyas Puranik | Pratibha S | Prashant | Sandeep S,2025-03-15T05:30:04Z,1025570,2231,10,180
"Maa Song- Trending Version (Lyrics) | Aamir Khan, Darsheel | Shankar Mahadevan | Taare Zameen Par",2025-03-14T14:30:12Z,49264,1380,10,155
"Wo Ladki Hai Kahan - Trending Version (Lyrics) | Dil Chahta Hai | Saif Ali Khan, Sonali Kulkarni",2025-03-14T13:30:22Z,66045,1585,24,106
RETRO - GULL AINAA (Song) | Suriya | Karthik Subbaraj | Pooja Hegde | Santhosh Narayanan,2025-03-14T10:00:49Z,110701,6595,10,345
ULTIMATE HOLY PARTY HITS (NON-STOP SONGS) | BOLLYWOOD PARTY SONGS | T-SERIES,2025-03-14T06:30:20Z,49103,656,10,59
Khushalii Kumar 😍 - Rang Ishq ka 💕 | #Holi #YTShorts,2025-03-14T06:22:38Z,20162,606,10,29
BOLLYWOOD HOLI PARTY MASHUP NON-STOP | KEDROCK X SD STYLE | NON-STOP DANCE SONGS | HOLI SPECIAL,2025-03-14T05:00:22Z,444293,5724,10,395
"Balam Pichkari (Circuit Remix): Ranbir, Deepika | Holi Special | Kedrock, SD Style",2025-03-14T03:42:55Z,268595,1914,10,96
"Balam Pichkari (Remix): Ranbir K, Deepika P |Holi Special |Yeh Jawaani Hai Deewani |DJ Star,DJ Harsh",2025-03-13T15:36:31Z,348296,2675,10,150
"Honeymoon Title Track - Trending Version (Lyrics) | Gippy G, Jasmine B | Simar Kaur | B Praak, Jaani",2025-03-13T15:01:40Z,9277,198,10,46
"Highway: Sooha Saaha - Trending Version (Lyrics) | Alia Bhatt | A.R. Rahman, Randeep Hooda",2025-03-13T14:30:01Z,5885,156,10,38
Yaariyan: Sunny Sunny - Trending Version (Lyrics) | Yo Yo Honey Singh | Neha K | Divya K | Himansh K,2025-03-13T13:31:04Z,78358,5301,10,462
"The Diplomat (Audio Jukebox): John Abraham | A.R. Rahman | Hariharan | Manan Bhardwaj, Romy, Anurag",2025-03-13T12:00:10Z,41295,1058,24,83
MANIAC 100M+ VIEWS😍🔥 | YO YO HONEY SINGH | ESHA GUPTA | GLORY | BHUSHAN KUMAR,2025-03-13T11:45:45Z,45633,3424,10,43
"The Diplomat: Ghar (Full Audio) John Abraham | Anurag Saikia, Varun Jain, Romy | Sadia Khatib",2025-03-13T11:30:07Z,8057,197,10,19
"The Diplomat: Naina (Full Audio) John Abraham | Varun Jain, Romy, Anurag Saikia, Kausar Munir",2025-03-13T10:59:31Z,5331,142,10,34
CRAZXY: Chann Ve (Video Song) | Sohum Shah | Gulzar | Sukhwinder Singh | Vishal Bhardwaj | Debarpito,2025-03-13T10:00:07Z,29020,727,10,90
Artiste: Roye Har Pal Dil Ye - Promo | Santosh | Krisheka | Soniya | Suresh B | James K | Ratanrishi,2025-03-13T09:31:28Z,6186,92,10,22
Pintu Ki Pappi: Bela Kali (Song) | Shushant | Ganesh Acharya | Narottam | Shafaat Ali | Shiv Hare,2025-03-13T07:30:06Z,1932207,51228,10,3000
RANG BARSE RELOADED: BOLLYWOOD HOLI MASHUP | NON-STOP DANCE SONGS | DJ SUNNY SINGH UK | T-SERIES,2025-03-13T04:43:55Z,881032,8619,10,341
"Fashion Ka Jalwa: Trending Version (Lyrical Video) | Priyanka Chopra, Kangana Ranaut|Salim- Sulaiman",2025-03-12T15:46:49Z,14529,267,10,35
"Jhaanjar - Trending Version (Lyrical Video): B Praak, Jaani, Gippy Grewal, Jasmine Bhasin |Honeymoon",2025-03-12T14:30:22Z,23043,507,10,57
"GO PAGAL (Remix): Akshay Kumar | Raftaar | Huma | Holi Special | Jolly LLB 2 | Dj Lemon, Dj Star",2025-03-12T13:30:50Z,45683,988,10,80
Be Happy (Audio Jukebox): Abhishek A Bachchan | Nora Fatehi | Inayat Verma | Harsh Upadhyay,2025-03-12T11:30:39Z,9439,297,10,37
"Be Happy: Sultana (Remix) (Audio) | Nora Fatehi | Abhishek A Bachchan | Inayat | Sunidhi, Mika Singh",2025-03-12T11:30:14Z,6249,196,10,35
Be Happy: I Got the Moves (Audio) | Nora Fatehi | Abhishek A Bachchan | Inayat | Harsh Upadhyay,2025-03-12T11:27:59Z,2968,98,10,22
Be Happy: Dream (Audio) | Nora Fatehi | Abhishek A Bachchan | Inayat | Harsh Upadhyay 10 DREAM,2025-03-12T11:24:46Z,2613,62,10,12
"Be Happy (Title Track) (Audio) | Abhishek A Bachchan | Nora Fatehi  | Inayat | Harsh, Abhay, Pranav",2025-03-12T11:21:18Z,3044,88,10,17
Be Happy: Superstar (Kids Version) (Audio) | Abhishek A Bachchan | Nora Fatehi | Harsh Upadhyay,2025-03-12T11:17:28Z,2835,103,10,23
Be Happy: Praan Pita Ka (Audio) | Abhishek A Bachchan | Kailash Kher |  Inayat | Harsh  | Pranav,2025-03-12T11:13:24Z,2514,69,10,18
"Be Happy: Mazza Hi Mazza (Audio) | Nora Fatehi | Abhishek A Bachchan | Inayat | Harsh,Sukriti,Pranav",2025-03-12T11:06:58Z,2450,69,10,13
"Be Happy: Superstar (Audio) | Abhishek A Bachchan | Nora Fatehi | Mika Singh, Harsh,Pranav,Sukriti",2025-03-12T11:02:13Z,4291,190,10,17
"Be Happy: Mere Papa (Audio) | Abhishek A Bachchan | Inayat | Harsh,Senjuti,Jatinder,Pranav",2025-03-12T10:57:58Z,5232,246,10,61
"Be Happy: Devi Aayi (Audio) | Abhishek A Bachchan | Nora F | Shankar Mahadevan,Harsh,Pranav,Sukriti",2025-03-12T10:53:36Z,2711,92,10,14
"Be Happy: Raja (Audio) | Abhishek A Bachchan | Inayat | Harsh | Vishal Dadlani, Jatinder S, Pranav V",2025-03-12T10:49:43Z,2601,120,10,16
"Be Happy: Sultana (Audio) | Nora Fatehi | Abhishek A Bachchan | Sunidhi,Mika,Harsh,Pranav,Sukriti",2025-03-12T10:42:42Z,7742,311,10,63
"""A Walk Through the Journey of Uzma! "": The Diplomat | John Abraham | Shivam Nair | Bhushan Kumar",2025-03-12T10:39:09Z,458478,2423,10,145
Anjali Arora😍🔥 slaying with Sultana Song | Nora Fatehi | Sunidhi Chauhan | Be Happy,2025-03-12T08:33:45Z,59249,1678,10,40
States of matter | Middle school chemistry | Khan Academy,2025-03-12T07:00:27Z,4348,129,27,0
"""This is a tool they should be trying!""",2025-03-11T01:16:15Z,2855,86,27,1
Temperature and Celsius | Middle school chemistry | Khan Academy,2025-03-05T08:00:30Z,4716,141,27,0
How to use the Khan Academy Writing Coach,2025-03-05T00:08:53Z,7023,141,27,8
📝 Khan Academy Writing Coach is now FREE ✨,2025-02-27T18:47:16Z,2602,95,27,7
Click the link in the description to grab your free activities!,2025-02-26T15:42:50Z,5107,131,27,1
Physical changes | Middle school chemistry | Khan Academy,2025-02-26T08:00:42Z,3246,67,27,0
Closing Math Gaps with AI,2025-02-25T22:02:37Z,4959,47,27,4
Fall In Love With Writing,2025-02-25T21:54:25Z,4943,196,27,5
SAT Prep Strategies,2025-02-25T17:32:33Z,2386,56,27,0
Closing Science Gaps with AI,2025-02-25T17:32:25Z,1445,27,27,1
"We have free, ready-to-use science activities to make learning interactive & engaging. Download now!",2025-02-21T14:00:39Z,6372,176,27,1
Using The 5 Ws and the Bonus H to make summaries | Reading | Khan Academy,2025-02-20T15:22:40Z,5847,209,27,0
Physical properties | Middle school chemistry | Khan Academy,2025-02-19T08:00:29Z,4483,110,27,0
Lesson planning just got easier! The Khanmigo upgrade you've been asking for!,2025-02-18T18:09:35Z,1843,65,27,1
Miss Clarke is making learning fun and interactive with Khanmigo and @blooket7572 ! 🎉,2025-02-14T17:22:02Z,3047,66,27,1
Using context clues to determine the meaning of a word | Reading | Khan Academy,2025-02-12T16:58:56Z,6621,126,27,0
How to make inferences | Reading | Khan Academy,2025-02-12T16:39:01Z,3571,111,27,0
Types of mixtures | Middle school chemistry | Khan Academy,2025-02-12T08:00:54Z,3055,87,27,0
Properties of homogeneous mixtures | Middle school chemistry | Khan Academy,2025-02-12T08:00:48Z,2695,76,27,0
"Molecules, crystals, and diatomic elements | Middle school chemistry | Khan Academy",2025-02-05T08:00:48Z,7282,205,27,0
Using word parts to determine meaning | Reading | 5th Grade | Khan Academy,2025-02-03T17:58:51Z,5783,132,27,0
Compounds and chemical formulas | Middle school chemistry | Khan Academy,2025-01-29T08:00:03Z,8010,188,27,0
The periodic table | Middle school chemistry | Khan Academy,2025-01-22T08:00:15Z,12517,307,27,0
Introducing Blooket Generator! A New Partnership Between Khan Academy & Blooket.,2025-01-17T21:52:24Z,10614,187,27,15
Rhetorical devices and appeals | Reading | Khan Academy,2025-01-17T17:46:30Z,13327,231,27,11
Supporting an inference with logical reasoning and evidence | Reading | Khan Academy,2025-01-15T16:23:47Z,6404,99,27,16
Archaeology | Vocabulary | Khan Academy,2025-01-15T13:24:11Z,2306,35,27,0
Contemporary  | Vocabulary | Khan Academy,2025-01-15T13:23:18Z,2342,41,27,0
Authentic | Vocabulary | Khan Academy,2025-01-15T13:23:15Z,3703,63,27,0
Deception | Vocabulary | Khan Academy,2025-01-15T13:22:44Z,1714,37,27,0
Atoms | Middle school chemistry | Khan Academy,2025-01-15T08:00:28Z,6260,149,27,0
Analyzing the presentation of ideas | Reading | Khan Academy,2025-01-14T22:38:51Z,3230,52,27,4
Drama elements | Reading | Khan Academy,2025-01-14T22:06:28Z,2295,34,27,0
Poetry structures | Reading | Khan Academy,2025-01-14T22:06:24Z,3074,51,27,0
The value of historical context | Reading | Khan Academy,2025-01-14T22:03:14Z,2244,57,27,1
Similarities and differences: different accounts of the same topic | Reading | Khan Academy,2025-01-14T21:53:43Z,1318,20,27,0
Similarities and differences: primary and secondary sources | Reading | Khan Academy,2025-01-14T21:52:43Z,1481,23,27,1
Analyzing relationships in informational texts | Reading | Khan Academy,2025-01-14T21:21:52Z,1511,24,27,1
Analyzing visual evidence (and vampires) | Reading | Khan Academy,2025-01-14T21:10:25Z,1528,27,27,0
"Identifying ""hidden"" viewpoints | Reading | Khan Academy",2025-01-14T21:05:50Z,3222,104,27,5
How parts of an argument make a whole | Reading | Khan Academy,2025-01-14T20:37:14Z,2203,57,27,5
Choosing the best text evidence | Reading | Khan Academy,2025-01-14T19:43:20Z,4345,80,27,6
Introduction to middle school chemistry | Middle school chemistry | Khan Academy,2025-01-08T08:00:36Z,7611,179,27,0
Elements | Middle school chemistry | Khan Academy,2025-01-08T08:00:29Z,7265,179,27,0
Rhode Island and Khan Academy Info Session,2024-12-17T19:16:33Z,9616,104,27,11
How Khan Academy elevates potential (your stories),2024-12-16T05:00:02Z,5500,97,27,7
Khanmigo Lesson Hooks with Mrs. Higgason!,2024-12-13T17:22:43Z,3948,115,27,2
Debugging with test cases | Intro to CS - Python | Khan Academy,2024-11-26T06:00:56Z,12550,145,27,6
Free Financial Literacy Course: State Standards-Based Resources for Teachers!,2024-11-20T14:53:23Z,3234,117,27,8
Flow On The Go - 15 Minute Yoga Practice,2025-03-04T15:00:18Z,198185,7438,26,280
Yoga for Your Core | Hands Free,2025-02-22T06:00:07Z,293246,7768,26,351
Balloon Breath,2025-02-08T10:00:07Z,138089,3941,26,239
Prana - Day 8 Bonus!,2025-01-08T09:00:07Z,271417,8583,26,1063
Prana - Day 7,2025-01-07T09:00:14Z,388003,11710,26,1033
Prana - Day 6,2025-01-06T09:00:07Z,416365,11436,26,544
Prana - Day 5,2025-01-05T09:00:08Z,450230,12720,26,798
Prana - Day 4,2025-01-04T09:00:07Z,523547,13878,26,684
Prana - Day 3,2025-01-03T09:00:07Z,562872,16072,26,869
Prana - Day 2,2025-01-02T09:00:09Z,728695,19017,26,1108
Prana - Day 1,2025-01-01T09:00:07Z,1278590,32529,26,2040
Intro to Prana 7-Day Yoga Series,2024-12-28T20:46:59Z,131622,6088,26,154
Yoga for Digestion - Bija Practice,2024-12-21T10:00:08Z,265030,7667,26,346
Prana - A 7 Day Yoga Journey,2024-12-14T09:00:21Z,455591,18344,26,1008
Yoga For Seasonal Affective Disorder,2024-12-07T10:00:51Z,375544,9790,26,460
Restorative Yoga | Gratitude,2024-11-23T10:00:07Z,252956,6616,26,371
Turn The Page Meditation,2024-11-09T11:00:09Z,219031,7326,26,550
Yoga For Lizards,2024-10-26T10:00:42Z,326718,12755,26,1315
Yoga for Overthinking | 30 Minute Yoga Practice,2024-10-05T18:11:10Z,805121,18800,26,758
Morning Mobility Yoga | Wake Up and Stretch!,2024-09-21T05:00:01Z,3109744,53965,26,1463
Morning Wake Up Meditation,2024-08-31T05:00:08Z,345554,9182,26,428
Healing Yoga Break,2024-08-17T05:00:10Z,935393,16692,26,691
Bee Breath | Bhramari Pranayama,2024-08-03T05:00:22Z,268862,7649,26,540
Regulate Your Nervous System    #anxiety #panicattack #fightorflight,2024-07-16T19:45:14Z,117335,4628,26,50
Regulate Your Nervous System | 15 Minute Yoga Practice,2024-07-13T05:00:07Z,932797,19925,26,655
Power And Balance | 30-Minute Yoga Practice,2024-07-01T11:00:07Z,948282,19160,26,724
New Moon Yoga,2024-06-16T11:00:04Z,578670,11573,26,636
Yoga For Your Calves (and Ankles),2024-06-03T11:00:08Z,476542,10546,26,540
Yoga Flow For Beginners |  Intro To Flow,2024-05-20T11:00:07Z,653575,14263,26,430
Morning Hip Release | 15 Minute Yoga Practice,2024-05-06T11:00:07Z,1617958,26847,26,609
Lower Body Strength | 30 Minute Yoga Practice,2024-04-15T11:00:47Z,684184,13926,26,424
Yoga For Abdominal Strength,2024-04-01T11:00:27Z,691937,13814,26,439
10 Minute Full Body Stretch,2024-03-11T11:00:42Z,2886980,41820,26,826
Chest & Upper Body Opening Flow,2024-03-04T12:00:18Z,735808,15393,26,657
Quad Release - 15 minute Yoga Practice,2024-02-19T12:00:22Z,655275,11716,26,391
Yoga For Tired Feet - 14 Minute Yoga Practice,2024-02-06T06:00:08Z,407739,9018,26,378
Flow - Day 31 - Epilogue,2024-02-01T06:00:03Z,252023,10539,26,1053
Flow - Day 30 - Flow,2024-01-31T06:00:09Z,599106,15430,26,3665
Flow - Day 29 - Trust,2024-01-30T06:00:20Z,609360,13741,26,1016
Flow - Day 28 - Intuit,2024-01-29T06:00:10Z,636232,14163,26,792
Flow - Day 27 - Speak,2024-01-28T06:00:01Z,652354,14866,26,850
Flow - Day 26 - Open,2024-01-27T06:00:10Z,718013,15069,26,796
Flow - Day 25 - Action,2024-01-26T06:00:12Z,667288,14690,26,859
Flow - Day 24 - Create,2024-01-25T06:00:01Z,680246,14820,26,762
Flow - Day 23 - Root,2024-01-24T06:00:06Z,718475,16035,26,885
Flow - Day 22 - Truth,2024-01-23T06:00:09Z,694028,15449,26,972
Flow - Day 21 - Curious,2024-01-22T06:00:10Z,735928,15790,26,1039
Flow - Day 20 - Inward,2024-01-21T06:00:30Z,814843,17002,26,995
Flow - Day 19 - Ride,2024-01-20T06:00:06Z,779523,17291,26,1104
Flow - Day 18 - Meditate,2024-01-19T06:00:08Z,620454,14496,26,813
LIVE PM Modi's 'Epic 3-hour Podcast' With Lex Fridman  | Fridman Calls Conversation  'Most Powerful',2025-03-16T10:17:56Z,1430,32,25,0
"Multiple Attacks On The Pakistan Army LIVE Updates | BLA,  Taliban Strikes Pakistan Army | LIVE News",2025-03-16T11:19:37Z,2979,24,25,0
Massive Attack On The Pakistan Army LIVE NEWS | Baloch Insurgents Claim 90 Killed In Attack,2025-03-16T10:55:45Z,3155,36,25,0
"LIVE Sunita Williams, Butch Wilmore To Return After 9 Months | SpaceX's Crew-10 Docks At ISS",2025-03-16T10:47:02Z,2256,33,25,0
LIVE: Baloch Insurgents Claim 90 PAK Army Personnel Killed | Sunita Williams News | Tej Pratap Row,2025-03-16T10:09:37Z,692,4,25,0
Sunita Williams Rescue Mission LIVE Updates | Crew-10 Docked At International Space Station,2025-03-16T10:24:58Z,1898,23,25,0
"Baloch Army Ambushes Pakistan Army Convoy, Claims 90 Officers Killed in Noshki",2025-03-16T12:10:02Z,865,11,25,6
"Baloch Army Intensifies Attacks on Pakistani Forces, Chinese Investments Under Threat",2025-03-16T11:56:41Z,849,13,25,3
Pakistan Troops Face Multiple Ambushes: Taliban Attack Injures 9 in Bajaur Region,2025-03-16T11:18:21Z,1445,26,25,5
Pakistan Army Faces Mounting Challenges As Attacks Escalate In Balochistan | India Today,2025-03-16T10:43:27Z,7442,92,25,26
Sunita Williams Rescue Mission LIVE | SpaceX Launches Crew-10 To Bring Home Sunita & Butch,2025-03-16T10:42:52Z,6818,29,25,0
NASA LIVE | Sunita Williams Latest News | SpaceX's Crew-10 Docks At ISS | Crew Dragon Live,2025-03-16T10:39:56Z,4650,29,25,0
Pakistan Army Faces Deadly Attacks In Balochistan As BLA Coordination With TTP Intensifies,2025-03-16T10:25:52Z,5594,103,25,21
Deadly Attack On Pakistan Army: Baloch Army Ambushes Convoy In Norsex Area | India Today,2025-03-16T10:18:01Z,4185,114,25,18
"Punjab CM Bhagwant Mann, AAP convenor Kejriwal visits Sri Harmandir Sahib Gurdwara in Amritsar",2025-03-16T09:40:04Z,330,12,25,1
Pakistan Attack News LIVE: Baloch Insurgents Claim 90 Killed In Attack On Pakistani Military Convoy,2025-03-16T09:22:53Z,8317,64,25,0
Pakistan Train Hijack LIVE Updates: BLA Claims to Have Killed 100 Pakistani Security Personnel,2025-03-16T09:22:37Z,6310,14,25,0
US News LIVE: US Launches Air Stikes On Houthis | US Military Carried Out Air Raids Against Houthis,2025-03-16T09:20:06Z,4031,49,25,0
Tej Pratap Yadav's Controversial Remarks To Cop LIVE | Thumka Lagao Or Get Suspended: Tej Pratap,2025-03-16T09:19:03Z,3511,8,25,0
First Images Of Baloch's 2nd Attack In Pakistan Which Killed 90 Army Personnel | India Today,2025-03-16T09:09:05Z,10911,227,25,38
Pakistan Attack News LIVE: Baloch Insurgents Claim 90 Killed In Attack On Pakistani Military Convoy,2025-03-16T08:56:17Z,37002,227,25,0
"Ambush On Convoy Of Pak Army Buses, BLA Claims 90 Pakistan Military Personnel Killed In Attack",2025-03-16T08:55:41Z,2068,38,25,16
"After Train Hijack, Baloch Attack Noshiki Area In Pakistan, Claims 90 Army Men Killed | India Today",2025-03-16T08:51:36Z,5143,104,25,49
"Another Baloch Attack In Pak: 90 Pakistan Army Men Killed In Noshki, Claims Baloch Liberation Army",2025-03-16T08:45:56Z,4832,94,25,19
"TVK Chief Vijay Attacks DMK Over ED TASMAC Raids, Demands Independent Probe Into Liquor Scam",2025-03-16T08:43:16Z,933,25,25,10
PM Modi's Podcast With Lex Fridman: RSS's Role And Contribution To Society Discussed | India Today,2025-03-16T08:38:48Z,720,8,25,0
"Tej Pratap Yadav Fined ₹4000 For Helmetless Scooter Ride, Cop Removed For Dancing | India Today",2025-03-16T08:37:26Z,3597,25,25,6
"LG VK Saxena, CM Rekha Gupta & Parvesh Verma review the drainage situation at Sunehri Pul Drain",2025-03-16T07:54:50Z,543,15,25,2
"Vadodara Car Crash: Accused Rakshit Ravish says he wasn’t drunk, blames potholes",2025-03-16T07:53:01Z,1142,21,25,1
"NASA's Crew-10 Arrives At ISS; Sunita Williams, Butch Wilmore Welcome Astronauts Before Departure",2025-03-16T07:49:25Z,2114,72,25,2
"DM & CO Anuj, along with other police personnel, play with colours and dance as they celebrate Holi",2025-03-16T07:44:35Z,573,15,25,0
Lashkar's Top Terrorist Abu Qatal Murdered In Pakistan | India's Most Wanted Terrorist Is Dead Now,2025-03-16T07:44:31Z,18209,192,25,29
"Vadodara Accident: Victim Breaks Silence, Recounts Horror #vadodara #carcrash #shorts #viralvideo",2025-03-16T07:29:46Z,1207,26,25,0
Bihar Cop Removed From Duty After Dancing On RJD Leader Tej Pratap's Orders | India Today,2025-03-16T07:26:06Z,2565,13,25,2
#sunitawilliams NASA's Crew 10 Docks At International Space Station #crew10 #nasa #spacemission,2025-03-16T07:18:13Z,2649,45,25,1
Tulsi Gabbard In India: US' National Intel Chief Arrives In India | NSA Ajit Doval To Chair Meet,2025-03-16T07:16:21Z,6754,190,25,24
"#nasacrew10 NASA's Crew-10 Enters ISS, Docking Scheduled Next | #sunitawilliams #iss #shorts",2025-03-16T07:08:17Z,2297,42,25,0
"Sunita WIlliams Speaks As NASA's Crew-10 Arrives At ISS, Set To Replace Crew-9 After 9-Month Mission",2025-03-16T07:07:36Z,17190,151,25,16
"Samuel Okudzeto Ablakwa, Ghana's Minister Of Foreign Affairs, Arrives In India #ghana #shorts",2025-03-16T07:04:02Z,444,5,25,0
Jammu & Kashmir News: Tourists Enjoy Chilly Morning At Dal Lake #dallake #jammuandkashmir #shorts,2025-03-16T06:58:17Z,514,7,25,0
"Like Father, Like Son: BJP's Shehzad Poonawalla Criticizes Tej Pratap Yadav #tejpratapyadav #shorts",2025-03-16T06:48:45Z,714,19,25,0
"DK Shivakumar, Karnataka Dy CM, Clarifies 4% Reservation For Minority #dkshivakumar #reservation",2025-03-16T06:46:08Z,288,12,25,0
"UP CM Yogi Holds Janata Darshan In Gorakhpur, Focuses On Resolving Land-Grabbing Complaints",2025-03-16T06:44:35Z,366,18,25,1
"Praful Bakshi, IAF Veteran & Defence Expert, Exposes Pakistan Army’s Kashmir Propaganda #kashmir",2025-03-16T06:42:49Z,786,8,25,0
Union Minister Ashwini Vaishnav Queues Up for Security Check At Chennai Airport,2025-03-16T06:42:08Z,555,10,25,1
K Kavitha Demands Apology From Telangana CM For Remarks Against KCR Rao #kkavitha #telangana #kcrrao,2025-03-16T06:39:49Z,491,15,25,0
"Breaking News: AR Rahman Hospitalised In Chennai For Chest Pain, May Undergo Angiogram | India Today",2025-03-16T06:29:01Z,1481,17,25,6
NASA LIVE | Sunita Williams Latest News | SpaceX Crew Docks At ISS To Save Stranded Astronauts,2025-03-16T05:44:39Z,11195,87,25,0
Sunita Williams Rescue 2025 LIVE |Sunita Williams Latest News | Sunita Williams LIVE | NASA LIVE,2025-03-16T05:22:09Z,37133,306,25,0
"Abu Qatal, Hafiz Saeed's Right-Hand Man, Killed By Unknown Gunman In Pakistan | India Today",2025-03-16T05:12:26Z,30731,420,25,66
A Softer Humanoid Robot for the Home,2025-03-16T12:01:21Z,1909,129,28,17
NASA's SpaceX Crew-10 Docks With the ISS: All the Highlights in 13 Minutes,2025-03-16T08:01:19Z,23099,1861,28,304
The Era of Fun New Tech Gadgets Is Over,2025-03-15T21:57:02Z,6125,533,28,24
"2026 Mercedes-Benz CLA Gets an EV Glow-Up, New EQ Technology",2025-03-15T12:00:43Z,13913,362,28,47
NASA’s SpaceX Crew-10 Launch: Everything That Happened in 12 Minutes,2025-03-15T00:48:12Z,400782,3216,28,423
Apple Intelligence Delay Isn't a Failure — The Problem Is Bigger Than Apple,2025-03-14T12:00:20Z,59628,3941,28,582
Unboxing the Black Nothing Phone (3a),2025-03-13T19:55:58Z,19736,573,28,10
"The Best TVs Under $1,000 in 2025",2025-03-13T12:00:06Z,10064,264,28,11
See the Latest Tech News and Reviews on CNET.com,2025-03-12T23:00:15Z,4903,170,28,12
Tonal 2: Tonal Is Back With More Smart Features and Heavier Weights,2025-03-12T12:00:03Z,2619,91,28,0
Xbox Handheld Console Might Launch This Year,2025-03-11T20:14:46Z,4856,306,28,14
M4 MacBook Air Review: Still Fantastic Even if Not Much Has Changed,2025-03-11T13:00:32Z,31963,607,28,70
Unboxing Apple's 2025 MacBook Air and Mac Studio,2025-03-11T13:00:15Z,3218,131,28,1
M4 MacBook Air Hands On,2025-03-11T13:00:13Z,3030,170,28,1
Nothing (3a) or (3a) Pro: Which Should You Buy?,2025-03-10T12:00:09Z,7530,308,28,8
Nothing Phone 3A/3A Pro Review: Flashy Design at an Affordable Price,2025-03-10T12:00:06Z,22941,381,28,56
Flying Over a Stopped Car: Alef Flying Car Takes Off,2025-03-09T12:00:59Z,33747,682,28,166
How Will IRS Layoffs Affect My Tax Returns?,2025-03-08T18:00:48Z,3761,127,28,3
Get Hulu and Max for Free With Your Food Delivery Membership,2025-03-08T15:30:25Z,3891,164,28,2
"There Are Too Many iPads! Digital Ownership Is Broken, and Baby Dino Robot | Tech Therapy",2025-03-08T13:01:18Z,30551,1022,28,153
Unboxing Apple's New M3 iPad Air and Magic Keyboard,2025-03-07T23:09:49Z,2076,64,28,6
The Most Eye Catching Thing on the New iPad,2025-03-07T22:50:14Z,9271,426,28,17
Oppo Find N5 Review: This Is What a Foldable Should Feel Like,2025-03-07T22:37:45Z,4122,226,28,5
The Best Devices at Mobile World Congress 2025,2025-03-07T16:01:10Z,112320,1420,28,64
M4 MacBook Air & New iPad Details That Blew Me Away,2025-03-07T13:00:10Z,84739,2273,28,151
Starship Flight Test 8: Everything That Happened in 10 Minutes,2025-03-07T01:15:30Z,33357,666,28,263
Meet the Anker Solix Cloak Concept,2025-03-07T00:29:26Z,5320,259,28,26
How Many Android Pins Can We Find at MWC?,2025-03-07T00:24:59Z,2920,126,28,2
Aurzen Zip - A Tiny Foldable Projector,2025-03-06T22:22:51Z,7914,388,28,31
Intuitive Machines-2 Makes Its Lunar Landing: Sends Moon Images from Descent,2025-03-06T19:59:36Z,18162,296,28,82
Apple Announces New M4 MacBook Airs and New Mac Studio,2025-03-05T14:01:16Z,8767,257,28,5
New M4 MacBook Airs and M3 Ultra Mac Studio are Coming!,2025-03-05T14:00:12Z,60043,1047,28,86
Xiaomi Unveils Modular Lens Concept at MWC 2025,2025-03-05T11:00:21Z,13374,319,28,1
When You're Trying to Be Friendly But Remember You're a Robot,2025-03-05T10:00:17Z,8559,274,28,4
Nokia is Still Very Much Alive at MWC 2025,2025-03-05T08:00:21Z,9418,269,28,5
realme Unveils Interchangeable Mobile Lens Concept at MWC 2025,2025-03-05T02:00:15Z,7121,299,28,14
"iPad Air M3 and New iPad: No Price Bumps, Thank Goodness",2025-03-04T23:26:43Z,51954,1180,28,98
Auto Morphin Mighty Morphin Power Rangers by Playmates,2025-03-04T19:02:22Z,4864,262,28,15
Galaxy A Series First Look: Three New Phones Under $500,2025-03-04T18:00:29Z,20955,609,28,77
Jurassic World T. Rex Hatchimal Hatches in Realtime,2025-03-04T17:26:31Z,9316,297,28,12
"TECNO Mobile Debuts ""the world's slimmest"" Smartphone at MWC 2025",2025-03-04T16:42:34Z,21639,464,28,13
Nothing Phone (3a) Pro vs. iPhone 16 Pro: Photo Comparison,2025-03-04T13:55:52Z,14895,393,28,9
"Samsung’s Stretchable, Rollable and Foldable Screens Are on Display at MWC 2025",2025-03-04T13:01:12Z,35722,721,28,40
Unboxing: Nothing Phone 3a in Blue (UK Exclusive),2025-03-04T10:45:00Z,112412,4402,28,61
Unboxing: Nothing Phone 3a Pro,2025-03-04T10:30:33Z,349880,12761,28,91
First Look at Samsung's Galaxy A26 and A36,2025-03-03T21:40:48Z,24374,802,28,30
Samsung Display's Asymmetric Flip Concept at MWC 2025,2025-03-03T19:06:03Z,13224,328,28,20
15 Photos With the Xiaomi 15 Ultra,2025-03-03T15:23:01Z,19723,506,28,7
Oppo Find N5 Review: What a Foldable Phone Should Be,2025-03-03T13:01:24Z,37803,832,28,108
